{
  "version": "0.5.0-alpha",
  "containerId": "CLI-HelloWorld-v050",
  "containment": "processcontainer",
  "process": {
    "commandLine": "python -c \"import sys; print('Hello from MXC 0.5.0-alpha!'); print(f'Python version: {sys.version}')\""
  },
  "processContainer": {
    "capabilities": [
      "permissiveLearningMode"
    ]
  },
  "ui": {
    "disable": false
  }
}
