{
  "version": "0.6.0-alpha",
  "containerId": "CLI-ProcessIntent-Test",
  "containment": "process",
  "process": {
    "commandLine": "python -c \"import sys; print(f'Hello from Python {sys.version}'); print('Process intent test successful')\"",
    "timeout": 30000
  },
  "filesystem": {
    "readwritePaths": [
      "C:\\Users\\AdminUser\\AppData\\Local\\Programs"
    ]
  },
  "ui": {
    "disable": false
  }
}
