{
  "version": "0.4.0-alpha",
  "containerId": "CLI-Pwsh",
  "containment": "processcontainer",
  "process": {
    "commandLine": "pwsh.exe -nop -nol -c \"Set-PSReadLineOption -HistorySaveStyle SaveNothing; Set-Location c:\\temp\"; Get-Location"
  },
  "filesystem": {
    "readwritePaths": [
      "C:\\Program Files\\PowerShell\\7",
      "C:\\temp",
      "C:\\Users",
      "C:\\Users\\stscha\\AppData\\Roaming\\Microsoft\\Windows\\PowerShell\\PSReadLine"
    ],
    "readonlyPaths": [
      "C:\\"
    ]
  }
}