{
  "version": "0.4.0-alpha",
  "containerId": "UI-Test-04",
  "containment": "processcontainer",
  "process": {
    "commandLine": "cmd.exe /c \"echo test | clip.exe && echo FAIL: wrote clipboard || echo PASS: clipboard write blocked\"",
    "timeout": 15000
  },
  "processContainer": { "capabilities": [], "ui": { "isolation": "desktop", "desktopSystemControl": false, "systemSettings": "none", "ime": false } },
  "ui": { "disable": false, "clipboard": "read", "injection": false }
}
