{
  "version": "0.4.0-alpha",
  "containerId": "CLI-Network-Firewall-Test",
  "containment": "processcontainer",
  "process": {
    "commandLine": "python -c \"import urllib.request\nimport socket\n\nfrom colorama import Fore, Style\n\nprint('Testing network firewall enforcement...')\nprint('')\n\n# Test 1: Try to connect to allowed host (should succeed)\nprint('Test 1: Connecting to allowed host (api.github.com)...')\ntry:\n    response = urllib.request.urlopen('https://api.github.com', timeout=10)\n    print(Fore.GREEN + f'  SUCCESS: Connected to api.github.com (status: {response.status})')\n    print(Style.RESET_ALL)\nexcept Exception as e:\n    print(Fore.RED + f'  ERROR: Failed to connect to api.github.com: {e}')\n    print(Style.RESET_ALL)\n\nprint('')\n\n# Test 2: Try to connect to blocked host (should fail/timeout)\nprint('Test 2: Connecting to blocked host (google.com)...')\ntry:\n    response = urllib.request.urlopen('https://google.com', timeout=5)\n    print(Fore.RED + f'  ERROR: Should not have been able to connect to google.com!')\n    print(Style.RESET_ALL)\nexcept Exception as e:\n    print(Fore.GREEN + f'  SUCCESS: Connection to google.com was blocked as expected: {type(e).__name__}')\n    print(Style.RESET_ALL)\n\nprint('')\nprint('Network firewall test complete')\"",
    "timeout": 15000
  },
  "processContainer": {
    "capabilities": [
      "internetClient"
    ]
  },
  "filesystem": {
    "readwritePaths": [
      "C:\\Users\\AdminUser\\AppData\\Local\\Programs"
    ]
  },
  "network": {
    "defaultPolicy": "block",
    "enforcementMode": "firewall",
    "allowedHosts": [
      "api.github.com"
    ],
    "blockedHosts": []
  },
  "ui": {
    "disable": false
  }
}
